{
  "name": "JobInput",
  "type": "CORE:Blueprint",
  "description": "",
  "attributes": [
    {
      "name": "type",
      "type": "CORE:BlueprintAttribute",
      "attributeType": "string"
    },
    {
      "name": "_type",
      "type": "CORE:BlueprintAttribute",
      "attributeType": "string"
    },
    {
      "name": "referenceType",
      "type": "CORE:BlueprintAttribute",
      "attributeType": "string"
    },
    {
      "name": "jobInputAddress",
      "type": "CORE:BlueprintAttribute",
      "attributeType": "string"
    },
    {
      "name": "jobInputAddressScope",
      "type": "CORE:BlueprintAttribute",
      "attributeType": "string"
    }
  ]
}
