{
  "name": "TableColumnConfig",
  "type": "CORE:Blueprint",
  "description": "In addition to adding columns that extract fields from data, you can also pass predefined fields like ^tab and ^expandable as data name to add predefined functionality to your table. The order of columns you pass is the order it will be printed in.",
  "attributes": [
    {
      "name": "type",
      "type": "CORE:BlueprintAttribute",
      "attributeType": "string"
    },
    {
      "name": "data",
      "type": "CORE:BlueprintAttribute",
      "description": "Name of field you want to extract from data object",
      "attributeType": "string"
    },
    {
      "name": "dataType",
      "type": "CORE:BlueprintAttribute",
      "description": "Allowed values are 'string' | 'boolean' | 'number' | 'datetime'",
      "attributeType": "string",
      "default": "string",
      "optional": true
    },
    {
      "name": "presentAs",
      "type": "CORE:BlueprintAttribute",
      "description": "If dataType is of type boolean. Available values: checkbox, text",
      "attributeType": "string",
      "default": "checkbox",
      "optional": true
    },
    {
      "name": "label",
      "type": "CORE:BlueprintAttribute",
      "description": "Column label. Label will be name of data field by default",
      "attributeType": "string",
      "optional": true
    },
    {
      "name": "editable",
      "type": "CORE:BlueprintAttribute",
      "description": "Should data be editable in table edit mode.",
      "attributeType": "boolean",
      "default": true,
      "optional": true
    },
    {
      "name": "sortable",
      "type": "CORE:BlueprintAttribute",
      "attributeType": "boolean",
      "default": true,
      "optional": true
    },
    {
      "name": "onlyNumber",
      "type": "CORE:BlueprintAttribute",
      "description": "Only allow numbers to be entered in this column's cells in edit mode. The value is saved as a number.",
      "attributeType": "boolean",
      "default": false,
      "optional": true
    }
  ]
}
