{
  "name": "JobTargetAddress",
  "type": "CORE:Blueprint",
  "description": "",
  "attributes": [
    {
      "name": "type",
      "type": "CORE:BlueprintAttribute",
      "attributeType": "string"
    },
    {
      "name": "addressScope",
      "type": "CORE:BlueprintAttribute",
      "attributeType": "string"
    },
    {
      "name": "address",
      "type": "CORE:BlueprintAttribute",
      "attributeType": "string"
    }
  ]
}
