{
	"name": "CarList",
	"type": "CORE:Blueprint",
	"description": "",
	"attributes": [
		{
			"name": "type",
			"type": "dmss://system/SIMOS/BlueprintAttribute",
			"attributeType": "string",
			"default": "",
			"optional": false
		},
		{
			"name": "name",
			"type": "dmss://system/SIMOS/BlueprintAttribute",
			"attributeType": "string"
		},
		{
			"name": "Q1",
			"type": "CORE:BlueprintAttribute",
			"dimensions": "*",
			"attributeType": "./Car"
		},
		{
			"name": "Q2",
			"type": "CORE:BlueprintAttribute",
			"dimensions": "*",
			"attributeType": "./Car"
		}
	]
}
